{
  "$schema": "../schema.json",
  "locale": "he",
  "terms": {
    "optimization": "אופטימיזציה",
    "optimizationPlural": "אופטימיזציות",
    "optimizationTypeRun": "ריצה",
    "optimizationTypeRunPlural": "ריצות",
    "optimizationTypeGrid": "סריקה",
    "pair": "זוג",
    "program": "תוכנית",
    "task": "משימה",
    "statusPending": "ממתינה",
    "statusValidating": "באימות",
    "statusRunning": "רצה",
    "statusSuccess": "הצליחה",
    "statusFailed": "נכשלה",
    "statusCancelled": "בוטלה",
    "dataset": "דאטאסט",
    "row": "שורה",
    "example": "דוגמה",
    "inputColumn": "עמודת קלט",
    "outputColumn": "עמודת פלט",
    "split": "חלוקה",
    "splitTrain": "אימון",
    "splitVal": "אימות",
    "splitTest": "בדיקה",
    "baseline": "בסיס",
    "signature": "פרומפט התחלתי",
    "module": "מודול",
    "optimizer": "אופטימייזר",
    "optimizerPlural": "אופטימייזרים",
    "metric": "פונקציית מדידה",
    "score": "ציון",
    "scorePlural": "ציונים",
    "prediction": "תשובה",
    "model": "מודל",
    "provider": "ספק",
    "winningModel": "מודל מנצח",
    "reflectionModel": "מודל רפלקציה",
    "generationModel": "מודל מג׳נרט",
    "generationModelShort": "מג׳נרט",
    "generationModelPlural": "מודלי מג׳נרט",
    "modelConfig": "הגדרות מודל",
    "apiKey": "API key",
    "modelCatalog": "קטלוג מודלים",
    "baselineScore": "ציון בסיס",
    "optimizedScore": "ציון סופי",
    "scoreImprovement": "שיפור",
    "expectedScore": "ציון צפוי",
    "observedScore": "ציון בפועל",
    "exploreTitle": "מפת אופטימיזציות",
    "notificationNewOpt": "אופטימיזציה חדשה",
    "user": "משתמש",
    "type": "סוג",
    "error": "שגיאה",
    "examplePlural": "דוגמאות",
    "rowPlural": "שורות",
    "inputColumns": "עמודות הקלט",
    "outputColumnTarget": "עמודת היעד",
    "finalScore": "הציון הסופי",
    "modelPlural": "מודלים",
    "pairPlural": "זוגות",
    "candidate": "מועמד",
    "candidatePlural": "מועמדים",
    "parent": "הורה",
    "generation": "דור",
    "trajectory": "מסלול",
    "paretoFront": "חזית Pareto",
    "reflection": "רפלקציה",
    "prompt": "פרומפט",
    "seedCandidate": "מועמד התחלתי",
    "winningCandidate": "מועמד מוביל",
    "cancellationReason": "בוטלה על ידי המשתמש"
  },
  "messages": {
    "admin.forbidden": "רק מנהלים יכולים לבצע את הפעולה הזו.",
    "admin.invalid_username": "צריך להזין שם משתמש.",
    "admin.quota_save_failed": "לא הצלחנו לשמור את מגבלת המשתמש.",
    "analytics.other_bucket": "אחר",
    "auth.invalid_token": "פג תוקף ההתחברות או שהאסימון אינו תקין.",
    "auth.missing_token": "צריך להתחבר כדי לבצע את הפעולה הזו.",
    "auth.not_configured": "אימות מול השרת עדיין לא הוגדר.",
    "optimization.not_found": "{term.optimization} לא נמצאה: '{optimization_id}'.",
    "optimization.not_finished": "ה{term.optimization} עדיין לא הסתיימה.",
    "optimization.no_result": "ל{term.optimization} אין נתוני תוצאה.",
    "optimization.no_result_pending": "ל{term.optimization} עדיין אין תוצאה.",
    "optimization.no_result_for_artifact": "ל{term.optimization} אין תוצאה.",
    "optimization.no_payload": "ל{term.optimization} אין הגדרות שמורות.",
    "optimization.payload_unavailable": "ההגדרות השמורות של ה{term.optimization} אינן זמינות.",
    "optimization.dataset_unavailable": "ה{term.dataset} של ה{term.optimization} אינו זמין.",
    "optimization.no_metric_code": "ל{term.optimization} אין קוד {term.metric}.",
    "optimization.no_model_config": "לא נמצאה הגדרת {term.model}.",
    "optimization.no_program_artifact": "אין תוצר של {term.program}.",
    "optimization.no_program_artifact_scoped": "ל{term.optimization} אין תוצר של {term.program}.",
    "optimization.no_artifact_generic": "ה{term.optimization} לא ייצרה תוצר.",
    "optimization.corrupt_result": "נתוני תוצאת ה{term.optimization} פגומים.",
    "optimization.corrupt_column_mapping": "מיפוי העמודות השמור אינו תקין.",
    "optimization.not_success_status_for_serve": "ה{term.optimization} במצב '{status}' — רק {term.optimizationPlural} שהושלמו בהצלחה ניתנות להגשה.",
    "optimization.not_success_status_for_test_results": "ה{term.optimization} במצב '{status}' — רק ל{term.optimizationPlural} שהושלמו בהצלחה יש תוצאות {term.splitTest}.",
    "optimization.cancelled_no_artifact": "ה{term.optimization} בוטלה ולא ייצרה תוצר.",
    "optimization.failed_no_artifact": "ה{term.optimization} נכשלה ולא ייצרה תוצר. שגיאה: {error}",
    "optimization.already_terminal": "ה{term.optimization} כבר במצב סופי '{status}'.",
    "optimization.cannot_delete": "לא ניתן למחוק {term.optimization} במצב '{status}'. יש לבטל אותה קודם.",
    "optimization.clone_no_payload": "לאופטימיזציית המקור אין הגדרות שמורות לשכפול.",
    "optimization.retry_no_payload": "לאופטימיזציית המקור אין הגדרות שמורות להרצה חוזרת.",
    "optimization.retry_wrong_status": "ניתן להריץ מחדש רק {term.optimizationPlural} במצב 'נכשלה' או 'בוטלה' — זו במצב '{status}'. יש לשכפל במקום.",
    "optimization.cannot_resubmit_payload": "לא ניתן לשלוח מחדש את ההגדרות השמורות: {error}",
    "optimization.pairs_label": "{count, plural, one {{term.pair} אחד} two {שני {term.pairPlural}} other {# {term.pairPlural}}}",
    "grid_search.no_best_pair": "לסריקה אין זוג מוצלח.",
    "grid_search.no_best_program_artifact": "לזוג המוביל אין תוצר {term.program}.",
    "grid_search.pair_position_missing": "אין זוג במיקום {pair_index} בתוצאות הסריקה.",
    "grid_search.pair_failed_error": "הזוג במיקום {pair_index} נכשל: {error}",
    "grid_search.pair_no_artifact": "לזוג במיקום {pair_index} אין תוצר {term.program}.",
    "grid_search.pair_submission_grid_only": "הגשה לפי זוג זמינה רק בריצות של סריקה.",
    "grid_search.pair_test_results_grid_only": "תוצאות {term.splitTest} לפי זוג זמינות רק בריצות של סריקה.",
    "grid_search.not_a_grid_search": "ה{term.optimization} אינה סריקה.",
    "grid_search.artifact_per_pair_redirect": "ריצות של סריקה מייצרות תוצרים לכל זוג. יש להשתמש ב-GET /optimizations/{optimization_id}/grid-result במקום.",
    "grid_search.failed_no_result": "הסריקה נכשלה ולא הפיקה תוצאה. שגיאה: {error}",
    "grid_search.cancelled_no_result": "הסריקה בוטלה ולא הפיקה תוצאה.",
    "grid_search.no_result_available": "אין תוצאה זמינה לסריקה.",
    "grid_search.corrupt_result": "נתוני תוצאת הסריקה פגומים.",
    "grid_search.no_result_to_modify": "לסריקה אין תוצאה לשנות.",
    "grid_search.cannot_delete_pair": "לא ניתן למחוק זוג בזמן שה{term.optimization} במצב '{status}'. יש לבטל את ה{term.optimization} קודם.",
    "filter.invalid_status": "סינון סטטוס לא תקין '{value}'. ערכים חוקיים: {allowed}",
    "filter.invalid_optimization_type": "סינון סוג {term.optimization} לא תקין '{value}'. ערכים חוקיים: {allowed}",
    "quota.reached": "הגעתם למגבלת {quota} {term.optimizationPlural} לכל משתמש. מחקו {term.optimizationPlural} ישנות כדי ליצור חדשות.",
    "submit.no_models_available": "אין {term.modelPlural} זמינים בקטלוג — צריך להגדיר קודם API key של ספק.",
    "submission.validation_failed": "אימות ההגדרות נכשל: {error}",
    "submission.module_resolve_failed": "טעינת ה{term.module} נכשלה: {error}",
    "submission.staged_dataset_not_found": "מערך הנתונים שנשמר ({staged_dataset_id}) לא נמצא או שייך למשתמש אחר.",
    "submission.vision_required": "ה{term.dataset} מכיל עמודות תמונה ({fields}) אך ה{term.model} שנבחר ('{model}') אינו תומך בקלט תמונות. בחרו {term.model} עם תמיכה ב־vision.",
    "code_agent.upstream_failed": "שגיאה בסוכן הקוד: {error}",
    "health.workers_dead": "שרשורי העבודה אינם פועלים.",
    "health.workers_stuck": "שרשורי העבודה תקועים כבר {seconds} שניות.",
    "wizard.field_non_empty_string": "{field} חייב להיות מחרוזת לא ריקה.",
    "wizard.model_not_json_object": "{field} חייב להיות אובייקט JSON.",
    "wizard.model_name_non_empty_string": "{field}.name חייב להיות מחרוזת לא ריקה.",
    "wizard.model_name_missing_prefix": "{field}.name '{name}' חסר תחילית ספק. dspy.LM דורש מזהים מלאים כמו 'openai/gpt-4o-mini'. קראו ל-list_models_for_agent והעתיקו את השדה ``name`` כפי שהוא.",
    "wizard.signature_code_syntax_error": "signature_code אינו Python תקין: {error}. ודאו ששם המחלקה הוא מזהה יחיד ללא רווחים (למשל QASignature ולא 'QA Signature').",
    "wizard.signature_code_no_class": "signature_code חייב להגדיר מחלקה אחת לפחות שיורשת מ-dspy.Signature.",
    "wizard.metric_code_syntax_error": "metric_code אינו Python תקין: {error}.",
    "wizard.metric_code_no_callable": "metric_code חייב להגדיר פונקציה ברמת המודול (def …).",
    "wizard.code_via_authoring_only": "{field} אינו ניתן לעדכון דרך update_wizard_state. קוד ה-Signature וה-Metric נכתב רק דרך request_code_authoring, שמאמת את התוצאה לפני שהיא נכנסת ל-wizard.",
    "wizard.model_base_url_not_string": "{field}.base_url חייב להיות מחרוזת.",
    "wizard.model_number_required": "{field}.{key} חייב להיות מספר.",
    "wizard.model_max_tokens_int": "{field}.max_tokens חייב להיות מספר שלם.",
    "wizard.model_extra_not_object": "{field}.extra חייב להיות אובייקט.",
    "wizard.optimizer_kwargs_not_object": "optimizer_kwargs חייב להיות אובייקט.",
    "wizard.optimizer_unknown": "'{name}' אינו {term.optimizer} מוכר. ראו get_registry_snapshot לשמות הרשומים, או השתמשו בכינוי 'gepa' או בנתיב נקודות מלא כמו 'dspy.teleprompt.GEPA'.",
    "wizard.module_unknown": "'{name}' אינו {term.module} מוכר. השתמשו בכינויים 'predict' או 'cot', או בנתיב נקודות מלא כמו 'dspy.Predict'.",
    "dataset.sample_unknown": "{term.dataset} {term.example} לא ידוע '{sample_id}'. יש לקרוא ל-GET /datasets/samples לרשימת מזהים חוקיים.",
    "dataset.column_roles_unknown": "תפקידי העמודות מפנים לעמודות שלא קיימות ב-dataset_columns: {unknown}",
    "dataset.column_roles_invalid": "תפקידי עמודות לא תקינים (חייבים להיות 'input', 'output' או 'ignore'): {bad}",
    "dataset.column_roles_need_input": "לפחות עמודה אחת חייבת להיות בתפקיד 'input'.",
    "dataset.column_roles_need_output": "לפחות עמודה אחת חייבת להיות בתפקיד 'output'.",
    "dataset.profile.empty": "סט הנתונים חייב להכיל לפחות {term.row} אחת.",